A1: ENSAIOS PARA CANTAR NO DOMINGO
A2: MÚSICA | B2: TOM | C2: ENVIAR PARA O GRUPO | D2: ENSAIO | E2: DATA E DIA DE CANTAR | F2: VOZ PRINCIPAL | G2: VOZ SECUNDÁRIA | H2: TERCEIRA VOZ / RESERVA | I2: OK
C3: qui, 28/abril/2022 | D3: =C3+2 -> sáb, 30/abr/22 | E3: =D3+1 -> dom, 1/mai/22 | F3: ARIANE | G3: FELIPE | H3: VITÓRIA | I3: C
A4: Tua Presença- Paulo Neto | B4: D | C4: =D4-3 -> qua, 11/mai/22 | D4: sáb, 14/mai/22 | E4: dom, 15/mai/22 | F4: VITÓRIA | G4: FELIPE | H4: ARIANE | I4: C
A5: Consolador - Damares | B5: G | C5: =D5-3 -> qua, 11/mai/22 | D5: sáb, 14/mai/22 | E5: dom, 15/mai/22 | F5: ARIANE | G5: FELIPE | H5: VITÓRIA | I5: C
A6: Louvado Seja o Senhor | B6: D | C6: =D6-3 -> qua, 11/mai/22 | D6: sáb, 14/mai/22 | E6: dom, 15/mai/22 | F6: JONATAS | G6: JAILANE | H6: - | I6: C
C7: qui, 19/maio/22 | D7: =C7+2 -> sáb, 21/mai/22 | E7: =D7+1 -> dom, 22/mai/22 | F7: LEVI | G7: FABRICIO | H7: ARIANE | I7: û
C8: =C7+7 -> qui, 26/mai/22 | D8: =C8+2 -> sáb, 28/mai/22 | E8: =D8+1 -> dom, 29/mai/22 | F8: FELIPE | G8: JAILANE | H8: VITÓRIA | I8: û
C9: =C8+7 -> qui, 2/jun/22 | D9: =C9+2 -> sáb, 4/jun/22 | E9: =D9+1 -> dom, 5/jun/22 | F9: JONATAS | G9: VITÓRIA | H9: ARIANE | I9: û
C10: qui, 16/jun/22 | D10: =C10+2 -> sáb, 18/jun/22 | E10: =D10+1 -> dom, 19/jun/22 | F10: FABRICIO | G10: JAILANE | H10: JONATAS | I10: û
C11: =C10+7 -> qui, 23/jun/22 | D11: =C11+2 -> sáb, 25/jun/22 | E11: =D11+1 -> dom, 26/jun/22 | F11: VITÓRIA | G11: FELIPE | H11: JAILANE | I11: û
C12: =C11+7 -> qui, 30/jun/22 | D12: =C12+2 -> sáb, 2/jul/22 | E12: =D12+1 -> dom, 3/jul/22 | F12: LEVI | G12: JONATAS | H12: FELIPE | I12: û
C13: qui, 14/jul/22 | D13: =C13+2 -> sáb, 16/jul/22 | E13: =D13+1 -> dom, 17/jul/22 | F13: ARIANE | G13: VITÓRIA | H13: FELIPE | I13: û
C14: =C13+7 -> qui, 21/jul/22 | D14: =C14+2 -> sáb, 23/jul/22 | E14: =D14+1 -> dom, 24/jul/22 | F14: FELIPE | G14: LEVI | H14: FABRICIO | I14: û
C15: =C14+7 -> qui, 28/jul/22 | D15: =C15+2 -> sáb, 30/jul/22 | E15: =D15+1 -> dom, 31/jul/22 | F15: JAILANE | G15: VITÓRIA | H15: LEVI | I15: û
C16: =C15+7 -> qui, 4/ago/22 | D16: =C16+2 -> sáb, 6/ago/22 | E16: =D16+1 -> dom, 7/ago/22 | F16: LEVI | G16: FELIPE | H16: ARIANE | I16: û
C17: qui, 18/ago/22 | D17: =C17+2 -> sáb, 20/ago/22 | E17: =D17+1 -> dom, 21/ago/22 | F17: ARIANE | G17: FABRICIO | H17: VITÓRIA | I17: û
C18: =C17+7 -> qui, 25/ago/22 | D18: =C18+2 -> sáb, 27/ago/22 | E18: =D18+1 -> dom, 28/ago/22 | F18: LEVI | G18: JAILANE | H18: JONATAS | I18: û
C19: =C18+7 -> qui, 1/set/22 | D19: =C19+2 -> sáb, 3/set/22 | E19: =D19+1 -> dom, 4/set/22 | F19: VITÓRIA | G19: ARIANE | H19: JAILANE | I19: û
C20: qui, 15/set/22 | D20: =C20+2 -> sáb, 17/set/22 | E20: =D20+1 -> dom, 18/set/22 | F20: FELIPE | G20: FABRICIO | H20: LEVI | I20: û
C21: =C20+7 -> qui, 22/set/22 | D21: =C21+2 -> sáb, 24/set/22 | E21: =D21+1 -> dom, 25/set/22 | F21: JAILANE | G21: JONATAS | H21: ARIANE | I21: û
C22: =C21+7 -> qui, 29/set/22 | D22: =C22+2 -> sáb, 1/out/22 | E22: =D22+1 -> dom, 2/out/22 | F22: FABRICIO | G22: VITÓRIA | H22: FELIPE | I22: û
C23: qui, 13/out/22 | D23: =C23+2 -> sáb, 15/out/22 | E23: =D23+1 -> dom, 16/out/22 | F23: LEVI | G23: FELIPE | H23: VITÓRIA | I23: û
C24: =C23+7 -> qui, 20/out/22 | D24: =C24+2 -> sáb, 22/out/22 | E24: =D24+1 -> dom, 23/out/22 | F24: ARIANE | G24: JAILANE | H24: JONATAS | I24: û
C25: =C24+7 -> qui, 27/out/22 | D25: =C25+2 -> sáb, 29/out/22 | E25: =D25+1 -> dom, 30/out/22 | F25: FELIPE | G25: FABRICIO | H25: ARIANE | I25: û
C26: =C25+7 -> qui, 3/nov/22 | D26: =C26+2 -> sáb, 5/nov/22 | E26: =D26+1 -> dom, 6/nov/22 | F26: VITÓRIA | G26: JAILANE | H26: LEVI | I26: û
C27: qui, 17/nov/22 | D27: =C27+2 -> sáb, 19/nov/22 | E27: =D27+1 -> dom, 20/nov/22 | F27: FABRICIO | G27: JONATAS | H27: JAILANE | I27: û
C28: =C27+7 -> qui, 24/nov/22 | D28: =C28+2 -> sáb, 26/nov/22 | E28: =D28+1 -> dom, 27/nov/22 | F28: VITÓRIA | G28: FELIPE | H28: FABRICIO | I28: û
C29: =C28+7 -> qui, 1/dez/22 | D29: =C29+2 -> sáb, 3/dez/22 | E29: =D29+1 -> dom, 4/dez/22 | F29: JAILANE | G29: ARIANE | H29: LEVI | I29: û
C30: qui, 15/dez/22 | D30: =C30+2 -> sáb, 17/dez/22 | E30: =D30+1 -> dom, 18/dez/22 | F30: JONATAS | G30: LEVI | H30: JAILANE | I30: û
C31: =C30+7 -> qui, 22/dez/22 | D31: =C31+2 -> sáb, 24/dez/22 | E31: =D31+1 -> dom, 25/dez/22 | F31: JAILANE | G31: ARIANE | H31: JONATAS | I31: û
D33: cultos aos domingos
D34: QUANTAS VEZES? | E34: VOZ PRINCIPAL | F34: VOZ SECUNDÁRIA | G34: TERCEIRA VOZ OU RESERVA | H34: TOTAL
D35: ARIANE | E35: =COUNTIF(F3:F31;"ARIANE") -> 5 | F35: =COUNTIF(G3:G31;"ARIANE") -> 3 | G35: =COUNTIF(H3:H31;"ARIANE") -> 6 | H35: =SUM(E35:G35) -> 14
D36: FABRICIO | E36: =COUNTIF(F3:F31;"FABRICIO") -> 3 | F36: =COUNTIF(G3:G31;"FABRICIO") -> 4 | G36: =COUNTIF(#REF!;"FABRICIO") -> 2 | H36: =SUM(E36:G36) -> 9
D37: FELIPE | E37: =COUNTIF(F3:F30;"FELIPE") -> 4 | F37: =COUNTIF(G3:G31;"FELIPE") -> 7 | G37: =COUNTIF(H3:H31;"FELIPE") -> 3 | H37: =SUM(E37:G37) -> 14
D38: JAILANE | E38: =COUNTIF(F3:F31;"JAILANE") -> 4 | F38: =COUNTIF(G3:G31;"JAILANE") -> 6 | G38: =COUNTIF(H3:H31;"JAILANE") -> 4 | H38: =SUM(E38:G38) -> 14
D39: JONATAS | E39: =COUNTIF(F3:F31;"JONATAS") -> 3 | F39: =COUNTIF(G3:G31;"JONATAS") -> 3 | G39: =COUNTIF(H3:H31;"JONATAS") -> 4 | H39: =SUM(E39:G39) -> 10
D40: LEVI | E40: =COUNTIF(F3:F31;"LEVI") -> 5 | F40: =COUNTIF(G3:G31;"LEVI") -> 2 | G40: =COUNTIF(H3:H31;"LEVI") -> 4 | H40: =SUM(E40:G40) -> 11
D41: VITÓRIA | E41: =COUNTIF(F3:F31;"VITÓRIA") -> 5 | F41: =COUNTIF(G3:G31;"VITÓRIA") -> 4 | G41: =COUNTIF(H3:H31;"VITÓRIA") -> 5 | H41: =SUM(E41:G41) -> 14
A43: ENSAIOS PARA CANTAR NO CULTO DE JOVENS
A44: MÚSICA | B44: TOM | C44: ENVIAR PARA O GRUPO | D44: ENSAIO | E44: DATA E DIA DE CANTAR | F44: VOZ PRINCIPAL | G44: VOZ SECUNDÁRIA | H44: TERCEIRA VOZ OU RESERVA | I44: OK
C45: - | D45: sáb, 30/abr/22 | F45: VITÓRIA | G45: LEVI | H45: ARIANE | I45: ü
A46: Tua Graça me Basta | B46: E | F46: LEVI | G46: FELIPE | H46: JAILANE | I46: ü
F47: FELIPE | G47: VITÓRIA | H47: JONATAS | I47: ü
A48: Há Vida Aí | B48: A# | C48: - | D48: dias 14 e 21 | E48: sáb, 21/mai/22 | F48: ARIANE | G48: VITÓRIA | H48: LEVI / JONATAS | I48: C
A49: Me Leva Para Casa ? | B49: ? | F49: JAILANE | G49: FABRICIO | H49: LEVI / JONATAS | I49: D
A50: Árvore Cortada | B50: ? | F50: VITÓRIA | G50: ARIANE | H50: JAILANE | I50: D
C51: ter, 28/jun/22 | F51: ? | G51: ? | H51: ? | I51: D
C52: =D52-3 -> qua, 29/jun/22 | D52: sáb, 2/jul/22 | F52: JAILANE | G52: VITÓRIA | H52: FELIPE | I52: û
F53: LEVI | G53: VITÓRIA | H53: JAILANE | I53: û
F54: ANDRÉ | G54: FABRICIO | H54: FABRICIO | I54: û
C55: =D55-3 -> qua, 3/ago/22 | D55: =D52+35 -> sáb, 6/ago/22 | F55: VITÓRIA | G55: ANDRE | H55: FABRICIO | I55: û
F56: ANDRÉ | G56: VITÓRIA | H56: ARIANE | I56: û
F57: JONATAS | G57: ARIANE | H57: LEVI | I57: û
C58: =D58-3 -> qua, 31/ago/22 | D58: =D55+28 -> sáb, 3/set/22 | F58: LEVI | G58: FELIPE | H58: JONATAS | I58: û
F59: FABRICIO | G59: LEVI | H59: ANDRÉ | I59: û
F60: FELIPE | G60: ANDRÉ | H60: ARIANE | I60: û
C61: =D61-3 -> qua, 28/set/22 | D61: =D58+28 -> sáb, 1/out/22 | F61: JAILANE | G61: LEVI | H61: ARIANE | I61: û
F62: ANDRÉ | G62: JAILANE | H62: LEVI | I62: û
F63: ARIANE | G63: ANDRÉ | H63: JONATAS | I63: û
C64: =D64-3 -> qua, 2/nov/22 | D64: =D61+35 -> sáb, 5/nov/22 | F64: FELIPE | G64: JONATAS | H64: ANDRÉ | I64: û
F65: JONATAS | G65: ARIANE | H65: FABRICIO | I65: û
F66: ARIANE | G66: FELIPE | H66: JAILANE | I66: û
C67: =D67-3 -> qua, 30/nov/22 | D67: =D64+28 -> sáb, 3/dez/22 | F67: VITÓRIA | G67: FABRICIO | H67: JONATAS | I67: û
F68: ANDRÉ | G68: VITÓRIA | H68: LEVI | I68: û
F69: FABRICIO | G69: ANDRÉ | H69: ARIANE | I69: û
C71: cultos aos sábados
C72: QUANTAS VEZES? | D72: VOZ PRINCIPAL | E72: VOZ SECUNDÁRIA | F72: TERCEIRA VOZ OU RESERVA | G72: TOTAL
C73: ARIANE | D73: =COUNTIF(F45:F69;"ARIANE") -> 3 | E73: =COUNTIF(G45:G69;"ARIANE") -> 3 | F73: =COUNTIF(H45:H69;"ARIANE") -> 5 | G73: =SUM(D73:F73) -> 11
C74: FABRICIO | D74: =COUNTIF(F45:F69;"FABRICIO") -> 2 | E74: =COUNTIF(G45:G69;"FABRICIO") -> 3 | F74: =COUNTIF(H45:H69;"FABRICIO") -> 3 | G74: =SUM(D74:F74) -> 8
C75: FELIPE | D75: =COUNTIF(F45:F69;"FELIPE") -> 3 | E75: =COUNTIF(G45:G69;"FELIPE") -> 3 | F75: =COUNTIF(H45:H69;"FELIPE") -> 1 | G75: =SUM(D75:F75) -> 7
C76: JAILANE | D76: =COUNTIF(F45:F69;"JAILANE") -> 3 | E76: =COUNTIF(G45:G69;"JAILANE") -> 1 | F76: =COUNTIF(H45:H69;"JAILANE") -> 4 | G76: =SUM(D76:F76) -> 8
C77: JONATAS | D77: =COUNTIF(F45:F69;"JONATAS") -> 2 | E77: =COUNTIF(G45:G69;"JONATAS") -> 1 | F77: =COUNTIF(H45:H69;"JONATAS") -> 4 | G77: =SUM(D77:F77) -> 7
C78: LEVI | D78: =COUNTIF(F45:F69;"LEVI") -> 3 | E78: =COUNTIF(G45:G69;"LEVI") -> 3 | F78: =COUNTIF(H45:H69;"LEVI") -> 3 | G78: =SUM(D78:F78) -> 9
C79: VITÓRIA | D79: =COUNTIF(F45:F69;"VITÓRIA") -> 4 | E79: =COUNTIF(G45:G69;"VITÓRIA") -> 6 | F79: =COUNTIF(H45:H69;"VITÓRIA") -> 0 | G79: =SUM(D79:F79) -> 10
C80: ANDRÉ | D80: =COUNTIF(F45:F69;"ANDRÉ") -> 4 | E80: =COUNTIF(G45:G69;"ANDRÉ") -> 3 | F80: =COUNTIF(H45:H69;"ANDRÉ") -> 2 | G80: =SUM(D80:F80) -> 9