A1: ENSAIOS PARA CANTAR NO DOMINGO
A2: MÚSICA | B2: TOM | C2: ENVIAR PARA O GRUPO | D2: ENSAIO | E2: DATA E DIA DE CANTAR | F2: VOZ PRINCIPAL | G2: VOZ SECUNDÁRIA | H2: TERCEIRA VOZ / RESERVA
C3: 44679 | D3: =C3+2 -> 44681 | E3: =D3+1 -> 44682 | F3: ARIANE | G3: FELIPE | H3: VITÓRIA
A4: Tua Presença- Paulo Neto | B4: D | C4: =D4-3 -> 44692 | D4: 44695 | E4: 44696 | F4: VITÓRIA | G4: FELIPE | H4: ARIANE
A5: Consolador - Damares | B5: G | C5: =D5-3 -> 44692 | D5: 44695 | E5: 44696 | F5: ARIANE | G5: FELIPE | H5: VITÓRIA
A6: Louvado Seja o Senhor | B6: D | C6: =D6-3 -> 44692 | D6: 44695 | E6: 44696 | F6: JONATAS | G6: JAILANE | H6: -
A7: ? | C7: 44700 | D7: =C7+2 -> 44702 | E7: =D7+1 -> 44703 | F7: LEVI | G7: FABRICIO | H7: ARIANE
A8: Voce nao vai parar | C8: =C7+7 -> 44707 | D8: =C8+2 -> 44709 | E8: =D8+1 -> 44710 | F8: FELIPE | G8: JAILANE | H8: VITÓRIA
A9: Vim para adorar-Te | C9: =C8+7 -> 44714 | D9: =C9+2 -> 44716 | E9: =D9+1 -> 44717 | F9: JONATAS | G9: VITÓRIA | H9: ARIANE
C10: 44728 | D10: =C10+2 -> 44730 | E10: =D10+1 -> 44731 | F10: FABRICIO | G10: LEVI | H10: JAILANE
C11: X | D11: 44730 | E11: VIGILIA | F11: VITORIA | G11: ANDRE | H11: ?
C12: =C10+7 -> 44735 | D12: =C12+2 -> 44737 | E12: =D12+1 -> 44738 | F12: LEVI | G12: FELIPE | H12: ARIANE
C13: =C12+7 -> 44742 | D13: =C13+2 -> 44744 | E13: =D13+1 -> 44745 | F13: JAILANE | G13: JONATAS | H13: FELIPE
C14: 44756 | D14: =C14+2 -> 44758 | E14: =D14+1 -> 44759 | F14: ARIANE | G14: VITÓRIA | H14: FELIPE
C15: =C14+7 -> 44763 | D15: =C15+2 -> 44765 | E15: =D15+1 -> 44766 | F15: FELIPE | G15: LEVI | H15: FABRICIO
C16: =C15+7 -> 44770 | D16: =C16+2 -> 44772 | E16: =D16+1 -> 44773 | F16: JAILANE | G16: VITÓRIA | H16: LEVI
C17: =C16+7 -> 44777 | D17: =C17+2 -> 44779 | E17: =D17+1 -> 44780 | F17: LEVI | G17: FELIPE | H17: ARIANE
C18: 44791 | D18: =C18+2 -> 44793 | E18: =D18+1 -> 44794 | F18: ARIANE | G18: FABRICIO | H18: VITÓRIA
C19: =C18+7 -> 44798 | D19: =C19+2 -> 44800 | E19: =D19+1 -> 44801 | F19: LEVI | G19: JAILANE | H19: JONATAS
C20: =C19+7 -> 44805 | D20: =C20+2 -> 44807 | E20: =D20+1 -> 44808 | F20: VITÓRIA | G20: ARIANE | H20: JAILANE
C21: 44819 | D21: =C21+2 -> 44821 | E21: =D21+1 -> 44822 | F21: FELIPE | G21: FABRICIO | H21: LEVI
C22: =C21+7 -> 44826 | D22: =C22+2 -> 44828 | E22: =D22+1 -> 44829 | F22: JAILANE | G22: JONATAS | H22: ARIANE
C23: =C22+7 -> 44833 | D23: =C23+2 -> 44835 | E23: =D23+1 -> 44836 | F23: FABRICIO | G23: VITÓRIA | H23: FELIPE
C24: 44847 | D24: =C24+2 -> 44849 | E24: =D24+1 -> 44850 | F24: LEVI | G24: FELIPE | H24: VITÓRIA
C25: =C24+7 -> 44854 | D25: =C25+2 -> 44856 | E25: =D25+1 -> 44857 | F25: ARIANE | G25: JAILANE | H25: JONATAS
C26: =C25+7 -> 44861 | D26: =C26+2 -> 44863 | E26: =D26+1 -> 44864 | F26: FELIPE | G26: FABRICIO | H26: ARIANE
C27: =C26+7 -> 44868 | D27: =C27+2 -> 44870 | E27: =D27+1 -> 44871 | F27: VITÓRIA | G27: JAILANE | H27: LEVI
C28: 44882 | D28: =C28+2 -> 44884 | E28: =D28+1 -> 44885 | F28: FABRICIO | G28: JONATAS | H28: JAILANE
C29: =C28+7 -> 44889 | D29: =C29+2 -> 44891 | E29: =D29+1 -> 44892 | F29: VITÓRIA | G29: FELIPE | H29: FABRICIO
C30: =C29+7 -> 44896 | D30: =C30+2 -> 44898 | E30: =D30+1 -> 44899 | F30: JAILANE | G30: ARIANE | H30: LEVI
C31: 44910 | D31: =C31+2 -> 44912 | E31: =D31+1 -> 44913 | F31: JONATAS | G31: LEVI | H31: JAILANE
C32: =C31+7 -> 44917 | D32: =C32+2 -> 44919 | E32: =D32+1 -> 44920 | F32: JAILANE | G32: ARIANE | H32: JONATAS
D34: cultos aos domingos
D35: QUANTAS VEZES? | E35: VOZ PRINCIPAL | F35: VOZ SECUNDÁRIA | G35: TERCEIRA VOZ OU RESERVA | H35: TOTAL
D36: ARIANE | E36: =COUNTIF(F3:F32;"ARIANE") -> 5 | F36: =COUNTIF(G3:G32;"ARIANE") -> 3 | G36: =COUNTIF(H3:H32;"ARIANE") -> 7 | H36: =SUM(E36:G36) -> 15
D37: FABRICIO | E37: =COUNTIF(F3:F32;"FABRICIO") -> 3 | F37: =COUNTIF(G3:G32;"FABRICIO") -> 4 | G37: =COUNTIF(#REF!;"FABRICIO") -> 2 | H37: =SUM(E37:G37) -> 9
D38: FELIPE | E38: =COUNTIF(F3:F31;"FELIPE") -> 4 | F38: =COUNTIF(G3:G32;"FELIPE") -> 7 | G38: =COUNTIF(H3:H32;"FELIPE") -> 3 | H38: =SUM(E38:G38) -> 14
D39: JAILANE | E39: =COUNTIF(F3:F32;"JAILANE") -> 5 | F39: =COUNTIF(G3:G32;"JAILANE") -> 5 | G39: =COUNTIF(H3:H32;"JAILANE") -> 4 | H39: =SUM(E39:G39) -> 14
D40: JONATAS | E40: =COUNTIF(F3:F32;"JONATAS") -> 3 | F40: =COUNTIF(G3:G32;"JONATAS") -> 3 | G40: =COUNTIF(H3:H32;"JONATAS") -> 3 | H40: =SUM(E40:G40) -> 9
D41: LEVI | E41: =COUNTIF(F3:F32;"LEVI") -> 5 | F41: =COUNTIF(G3:G32;"LEVI") -> 3 | G41: =COUNTIF(H3:H32;"LEVI") -> 4 | H41: =SUM(E41:G41) -> 12
D42: VITÓRIA | E42: =COUNTIF(F3:F32;"VITÓRIA") -> 4 | F42: =COUNTIF(G3:G32;"VITÓRIA") -> 4 | G42: =COUNTIF(H3:H32;"VITÓRIA") -> 5 | H42: =SUM(E42:G42) -> 13
A44: ENSAIOS PARA CANTAR NO CULTO DE JOVENS
A45: MÚSICA | B45: TOM | C45: ENVIAR PARA O GRUPO | D45: ENSAIO | E45: DATA E DIA DE CANTAR | F45: VOZ PRINCIPAL | G45: VOZ SECUNDÁRIA | H45: TERCEIRA VOZ OU RESERVA
C46: - | D46: 44681 | F46: VITÓRIA | G46: LEVI | H46: ARIANE
A47: Tua Graça me Basta | B47: E | D47: 44681 | F47: LEVI | G47: FELIPE | H47: JAILANE
D48: 44681 | F48: FELIPE | G48: VITÓRIA | H48: JONATAS
A49: Há Vida Aí | B49: A# | C49: ter, 28/jun/22 | D49: dias 14 e 21 | E49: 44702 | F49: ARIANE | G49: FELIPE | H49: VITÓRIA
A50: Me Leva Para Casa | C50: ter, 28/jun/22 | D50: dias 14 e 21 | E50: 44702 | F50: JAILANE | G50: FABRICIO | H50: FELIPE
A51: Árvore Cortada | C51: ter, 28/jun/22 | D51: dias 14 e 21 | E51: 44702 | F51: VITÓRIA | G51: ARIANE | H51: JAILANE
C52: ter, 28/jun/22 | D52: dias 14 e 21 | E52: 44702 | F52: FELIPE | G52: LEVI | H52: FABRICIO
C53: =D53-3 -> 44741 | D53: 44744 | E53: 44744 | F53: JAILANE | G53: VITÓRIA | H53: FELIPE
C54: =D54-3 -> 44741 | D54: 44744 | E54: 44744 | F54: LEVI | G54: VITÓRIA | H54: JAILANE
C55: =D55-3 -> 44741 | D55: 44744 | E55: 44744 | F55: ANDRÉ | G55: FABRICIO | H55: FABRICIO
C56: =D56-3 -> 44776 | D56: =D53+35 -> 44779 | E56: =E53+35 -> 44779 | F56: VITÓRIA | G56: ANDRE | H56: FABRICIO
C57: =D57-3 -> 44776 | D57: =D54+35 -> 44779 | E57: =E54+35 -> 44779 | F57: ANDRÉ | G57: VITÓRIA | H57: ARIANE
C58: =D58-3 -> 44776 | D58: =D55+35 -> 44779 | E58: =E55+35 -> 44779 | F58: JONATAS | G58: ARIANE | H58: LEVI
C59: =D59-3 -> 44804 | D59: =D56+28 -> 44807 | E59: =E56+28 -> 44807 | F59: LEVI | G59: FELIPE | H59: JONATAS
C60: =D60-3 -> 44804 | D60: =D57+28 -> 44807 | E60: =E57+28 -> 44807 | F60: FABRICIO | G60: LEVI | H60: ANDRÉ
C61: =D61-3 -> 44804 | D61: =D58+28 -> 44807 | E61: =E58+28 -> 44807 | F61: FELIPE | G61: ANDRÉ | H61: ARIANE
C62: =D62-3 -> 44832 | D62: =D59+28 -> 44835 | E62: =E59+28 -> 44835 | F62: JAILANE | G62: LEVI | H62: ARIANE
C63: =D63-3 -> 44832 | D63: =D60+28 -> 44835 | E63: =E60+28 -> 44835 | F63: ANDRÉ | G63: JAILANE | H63: LEVI
C64: =D64-3 -> 44832 | D64: =D61+28 -> 44835 | E64: =E61+28 -> 44835 | F64: ARIANE | G64: ANDRÉ | H64: JONATAS
C65: =D65-3 -> 44867 | D65: =D62+35 -> 44870 | E65: =E62+35 -> 44870 | F65: FELIPE | G65: JONATAS | H65: ANDRÉ
C66: =D66-3 -> 44867 | D66: =D63+35 -> 44870 | E66: =E63+35 -> 44870 | F66: JONATAS | G66: ARIANE | H66: FABRICIO
C67: =D67-3 -> 44867 | D67: =D64+35 -> 44870 | E67: =E64+35 -> 44870 | F67: ARIANE | G67: FELIPE | H67: JAILANE
C68: =D68-3 -> 44895 | D68: =D65+28 -> 44898 | E68: =E65+28 -> 44898 | F68: VITÓRIA | G68: FABRICIO | H68: JONATAS
C69: =D69-3 -> 44895 | D69: =D66+28 -> 44898 | E69: =E66+28 -> 44898 | F69: ANDRÉ | G69: VITÓRIA | H69: LEVI
C70: =D70-3 -> 44895 | D70: =D67+28 -> 44898 | E70: =E67+28 -> 44898 | F70: FABRICIO | G70: ANDRÉ | H70: ARIANE
C72: cultos aos sábados
C73: QUANTAS VEZES? | D73: VOZ PRINCIPAL | E73: VOZ SECUNDÁRIA | F73: TERCEIRA VOZ OU RESERVA | G73: TOTAL
C74: ARIANE | D74: =COUNTIF(F46:F70;"ARIANE") -> 3 | E74: =COUNTIF(G46:G70;"ARIANE") -> 3 | F74: =COUNTIF(H46:H70;"ARIANE") -> 5 | G74: =SUM(D74:F74) -> 11
C75: FABRICIO | D75: =COUNTIF(F46:F70;"FABRICIO") -> 2 | E75: =COUNTIF(G46:G70;"FABRICIO") -> 3 | F75: =COUNTIF(H46:H70;"FABRICIO") -> 4 | G75: =SUM(D75:F75) -> 9
C76: FELIPE | D76: =COUNTIF(F46:F70;"FELIPE") -> 4 | E76: =COUNTIF(G46:G70;"FELIPE") -> 4 | F76: =COUNTIF(H46:H70;"FELIPE") -> 2 | G76: =SUM(D76:F76) -> 10
C77: JAILANE | D77: =COUNTIF(F46:F70;"JAILANE") -> 3 | E77: =COUNTIF(G46:G70;"JAILANE") -> 1 | F77: =COUNTIF(H46:H70;"JAILANE") -> 4 | G77: =SUM(D77:F77) -> 8
C78: JONATAS | D78: =COUNTIF(F46:F70;"JONATAS") -> 2 | E78: =COUNTIF(G46:G70;"JONATAS") -> 1 | F78: =COUNTIF(H46:H70;"JONATAS") -> 4 | G78: =SUM(D78:F78) -> 7
C79: LEVI | D79: =COUNTIF(F46:F70;"LEVI") -> 3 | E79: =COUNTIF(G46:G70;"LEVI") -> 4 | F79: =COUNTIF(H46:H70;"LEVI") -> 3 | G79: =SUM(D79:F79) -> 10
C80: VITÓRIA | D80: =COUNTIF(F46:F70;"VITÓRIA") -> 4 | E80: =COUNTIF(G46:G70;"VITÓRIA") -> 5 | F80: =COUNTIF(H46:H70;"VITÓRIA") -> 1 | G80: =SUM(D80:F80) -> 10
C81: ANDRÉ | D81: =COUNTIF(F46:F70;"ANDRÉ") -> 4 | E81: =COUNTIF(G46:G70;"ANDRÉ") -> 3 | F81: =COUNTIF(H46:H70;"ANDRÉ") -> 2 | G81: =SUM(D81:F81) -> 9