B1: ENSAIOS PARA CANTAR NO DOMINGO
B2: ENVIAR PARA O GRUPO | C2: ENSAIO | D2: DATA E DIA DE CANTAR | E2: VOZ PRINCIPAL | F2: VOZ SECUNDÁRIA | G2: TERCEIRA VOZ OU RESERVA | H2: OK
B3: qui, 28/abril/2022 | C3: =B3+2 -> sáb, 30/abr/22 | D3: =C3+1 -> dom, 1/mai/22 | E3: ARIANE | F3: FELIPE | G3: VITÓRIA | H3: û
B4: qui, 12/mai/22 | C4: =B4+2 -> sáb, 14/mai/22 | D4: =C4+1 -> dom, 15/mai/22 | E4: LEVI | F4: JAILANE | G4: JONATAS | H4: û
B5: =B4+7 -> qui, 19/maio/22 | C5: =B5+2 -> sáb, 21/mai/22 | D5: =C5+1 -> dom, 22/mai/22 | E5: VITÓRIA | F5: ARIANE | G5: FABRICIO | H5: û
B6: =B5+7 -> qui, 26/mai/22 | C6: =B6+2 -> sáb, 28/mai/22 | D6: =C6+1 -> dom, 29/mai/22 | E6: FELIPE | F6: LEVI | G6: VITÓRIA | H6: û
B7: =B6+7 -> qui, 2/jun/22 | C7: =B7+2 -> sáb, 4/jun/22 | D7: =C7+1 -> dom, 5/jun/22 | E7: JAILANE | F7: ARIANE | G7: FELIPE | H7: û
B8: qui, 16/jun/22 | C8: =B8+2 -> sáb, 18/jun/22 | D8: =C8+1 -> dom, 19/jun/22 | E8: JONATAS | F8: VITÓRIA | G8: ARIANE | H8: û
B9: =B8+7 -> qui, 23/jun/22 | C9: =B9+2 -> sáb, 25/jun/22 | D9: =C9+1 -> dom, 26/jun/22 | E9: FABRICIO | F9: JAILANE | G9: JONATAS | H9: û
B10: =B9+7 -> qui, 30/jun/22 | C10: =B10+2 -> sáb, 2/jul/22 | D10: =C10+1 -> dom, 3/jul/22 | E10: VITÓRIA | F10: FELIPE | G10: JAILANE | H10: û
B11: qui, 14/jul/22 | C11: =B11+2 -> sáb, 16/jul/22 | D11: =C11+1 -> dom, 17/jul/22 | E11: LEVI | F11: JONATAS | G11: FELIPE | H11: û
B12: =B11+7 -> qui, 21/jul/22 | C12: =B12+2 -> sáb, 23/jul/22 | D12: =C12+1 -> dom, 24/jul/22 | E12: ARIANE | F12: VITÓRIA | G12: FELIPE | H12: û
B13: =B12+7 -> qui, 28/jul/22 | C13: =B13+2 -> sáb, 30/jul/22 | D13: =C13+1 -> dom, 31/jul/22 | E13: FELIPE | F13: LEVI | G13: FABRICIO | H13: û
B14: =B13+7 -> qui, 4/ago/22 | C14: =B14+2 -> sáb, 6/ago/22 | D14: =C14+1 -> dom, 7/ago/22 | E14: JAILANE | F14: VITÓRIA | G14: LEVI | H14: û
B15: qui, 18/ago/22 | C15: =B15+2 -> sáb, 20/ago/22 | D15: =C15+1 -> dom, 21/ago/22 | E15: JONATAS | F15: FELIPE | G15: ARIANE | H15: û
B16: =B15+7 -> qui, 25/ago/22 | C16: =B16+2 -> sáb, 27/ago/22 | D16: =C16+1 -> dom, 28/ago/22 | E16: ARIANE | F16: FABRICIO | G16: VITÓRIA | H16: û
B17: =B16+7 -> qui, 1/set/22 | C17: =B17+2 -> sáb, 3/set/22 | D17: =C17+1 -> dom, 4/set/22 | E17: LEVI | F17: JAILANE | G17: JONATAS | H17: û
B18: qui, 15/set/22 | C18: =B18+2 -> sáb, 17/set/22 | D18: =C18+1 -> dom, 18/set/22 | E18: VITÓRIA | F18: ARIANE | G18: JAILANE | H18: û
B19: =B18+7 -> qui, 22/set/22 | C19: =B19+2 -> sáb, 24/set/22 | D19: =C19+1 -> dom, 25/set/22 | E19: FELIPE | F19: FABRICIO | G19: LEVI | H19: û
B20: =B19+7 -> qui, 29/set/22 | C20: =B20+2 -> sáb, 1/out/22 | D20: =C20+1 -> dom, 2/out/22 | E20: JAILANE | F20: JONATAS | G20: ARIANE | H20: û
B21: qui, 13/out/22 | C21: =B21+2 -> sáb, 15/out/22 | D21: =C21+1 -> dom, 16/out/22 | E21: FABRICIO | F21: VITÓRIA | G21: FELIPE | H21: û
B22: =B21+7 -> qui, 20/out/22 | C22: =B22+2 -> sáb, 22/out/22 | D22: =C22+1 -> dom, 23/out/22 | E22: LEVI | F22: FELIPE | G22: VITÓRIA | H22: û
B23: =B22+7 -> qui, 27/out/22 | C23: =B23+2 -> sáb, 29/out/22 | D23: =C23+1 -> dom, 30/out/22 | E23: ARIANE | F23: JAILANE | G23: JONATAS | H23: û
B24: =B23+7 -> qui, 3/nov/22 | C24: =B24+2 -> sáb, 5/nov/22 | D24: =C24+1 -> dom, 6/nov/22 | E24: FELIPE | F24: FABRICIO | G24: ARIANE | H24: û
B25: qui, 17/nov/22 | C25: =B25+2 -> sáb, 19/nov/22 | D25: =C25+1 -> dom, 20/nov/22 | E25: ARIANE | F25: LEVI | G25: FABRICIO | H25: û
B26: =B25+7 -> qui, 24/nov/22 | C26: =B26+2 -> sáb, 26/nov/22 | D26: =C26+1 -> dom, 27/nov/22 | E26: VITÓRIA | F26: JAILANE | G26: LEVI | H26: û
B27: =B26+7 -> qui, 1/dez/22 | C27: =B27+2 -> sáb, 3/dez/22 | D27: =C27+1 -> dom, 4/dez/22 | E27: FABRICIO | F27: JONATAS | G27: JAILANE | H27: û
B28: qui, 15/dez/22 | C28: =B28+2 -> sáb, 17/dez/22 | D28: =C28+1 -> dom, 18/dez/22 | E28: VITÓRIA | F28: FELIPE | G28: FABRICIO | H28: û
B29: =B28+7 -> qui, 22/dez/22 | C29: =B29+2 -> sáb, 24/dez/22 | D29: =C29+1 -> dom, 25/dez/22 | E29: JAILANE | F29: ARIANE | G29: LEVI | H29: û
B30: =B29+7 -> qui, 29/dez/22 | C30: =B30+2 -> sáb, 31/dez/22 | D30: =C30+1 -> dom, 1/jan/23 | E30: JONATAS | F30: LEVI | G30: JAILANE | H30: û
D32: cultos aos domingos
D33: QUANTAS VEZES? | E33: VOZ PRINCIPAL | F33: VOZ SECUNDÁRIA | G33: TERCEIRA VOZ OU RESERVA | H33: TOTAL
D34: ARIANE | E34: =COUNTIF(E3:E30;"ARIANE") -> 5 | F34: =COUNTIF(F3:F30;"ARIANE") -> 4 | G34: =COUNTIF(G3:G30;"ARIANE") -> 4 | H34: =SUM(E34:G34) -> 13
D35: FABRICIO | E35: =COUNTIF(E3:E30;"FABRICIO") -> 3 | F35: =COUNTIF(F3:F31;"FABRICIO") -> 3 | G35: =COUNTIF(G3:G31;"FABRICIO") -> 4 | H35: =SUM(E35:G35) -> 10
D36: FELIPE | E36: =COUNTIF(E3:E30;"FELIPE") -> 4 | F36: =COUNTIF(F3:F31;"FELIPE") -> 5 | G36: =COUNTIF(G3:G31;"FELIPE") -> 4 | H36: =SUM(E36:G36) -> 13
D37: JAILANE | E37: =COUNTIF(E3:E30;"JAILANE") -> 4 | F37: =COUNTIF(F3:F31;"JAILANE") -> 5 | G37: =COUNTIF(G3:G31;"JAILANE") -> 4 | H37: =SUM(E37:G37) -> 13
D38: JONATAS | E38: =COUNTIF(E3:E30;"JONATAS") -> 3 | F38: =COUNTIF(F3:F31;"JONATAS") -> 3 | G38: =COUNTIF(G3:G31;"JONATAS") -> 4 | H38: =SUM(E38:G38) -> 10
D39: LEVI | E39: =COUNTIF(E3:E30;"LEVI") -> 4 | F39: =COUNTIF(F3:F31;"LEVI") -> 4 | G39: =COUNTIF(G3:G31;"LEVI") -> 4 | H39: =SUM(E39:G39) -> 12
D40: VITÓRIA | E40: =COUNTIF(E3:E31;"VITÓRIA") -> 5 | F40: =COUNTIF(F3:F31;"VITÓRIA") -> 4 | G40: =COUNTIF(G3:G30;"VITÓRIA") -> 4 | H40: =SUM(E40:G40) -> 13
A42: ENSAIOS PARA CANTAR NO CULTO DOS JOVENS
A43: MUSICAS | B43: ENVIAR PARA O GRUPO | C43: ENSAIO | D43: DATA E DIA DE CANTAR | E43: VOZ PRINCIPAL | F43: VOZ SECUNDÁRIA | G43: TERCEIRA VOZ OU RESERVA | H43: OK
A44: 1 | B44: Há Vida Aí | C44: sáb, 30/abr/22 | D44: sáb, 14/mai/22 | E44: ARIANE | F44: FELIPE | G44: VITÓRIA | H44: ü
A45: 2 | B45: Me Leva Para Casa | C45: sáb, 7/mai/22 | E45: JAILANE | F45: FABRICIO | G45: LEVI | H45: ü
A46: 3 | B46: - | C46: sáb, 14/mai/22 | E46: - | F46: - | H46: û
A47: 1 | B47: =C47-2 -> qui, 2/jun/22 | C47: sáb, 4/jun/22 | E47: VITÓRIA | F47: LEVI | G47: ARIANE | H47: û
A48: 2 | E48: LEVI | F48: FELIPE | G48: JAILANE | H48: û
A49: 3 | E49: FELIPE | F49: VITÓRIA | G49: JONATAS | H49: û
A50: 1 | B50: =C50-2 -> qui, 30/jun/22 | C50: =C47+28 -> sáb, 2/jul/22 | E50: JAILANE | F50: ARIANE | G50: FABRICIO | H50: û
A51: 2 | E51: ARIANE | F51: JONATAS | G51: VITÓRIA | H51: û
A52: 3 | E52: JONATAS | F52: JAILANE | G52: LEVI | H52: û
A53: 1 | B53: =C53-2 -> qui, 4/ago/22 | C53: =C50+35 -> sáb, 6/ago/22 | E53: FABRICIO | F53: LEVI | G53: ARIANE | H53: û
A54: 2 | E54: LEVI | F54: FELIPE | G54: JAILANE | H54: û
A55: 3 | E55: FELIPE | F55: FABRICIO | G55: JONATAS | H55: û
A56: 1 | B56: =C56-2 -> qui, 1/set/22 | C56: =C53+28 -> sáb, 3/set/22 | E56: VITÓRIA | F56: ARIANE | G56: LEVI | H56: û
A57: 2 | E57: ARIANE | F57: JONATAS | G57: FELIPE | H57: û
A58: 3 | E58: JONATAS | F58: VITÓRIA | G58: JAILANE | H58: û
A59: 1 | B59: =C59-2 -> qui, 29/set/22 | C59: =C56+28 -> sáb, 1/out/22 | E59: FELIPE | F59: LEVI | G59: ARIANE | H59: û
A60: 2 | E60: LEVI | F60: FABRICIO | G60: VITÓRIA | H60: û
A61: 3 | E61: FABRICIO | F61: FELIPE | G61: JONATAS | H61: û
A62: 1 | B62: =C62-2 -> qui, 3/nov/22 | C62: =C59+35 -> sáb, 5/nov/22 | E62: ARIANE | F62: JAILANE | G62: FELIPE | H62: û
A63: 2 | E63: JAILANE | F63: VITÓRIA | G63: FABRICIO | H63: û
A64: 3 | E64: VITÓRIA | F64: ARIANE | G64: JONATAS | H64: û
A65: 1 | B65: =C65-2 -> qui, 1/dez/22 | C65: =C62+28 -> sáb, 3/dez/22 | E65: FELIPE | F65: JAILANE | G65: FABRICIO | H65: û
A66: 2 | E66: LEVI | F66: VITÓRIA | G66: ARIANE | H66: û
A67: 3 | E67: VITÓRIA | F67: ARIANE | G67: JAILANE | H67: û
D69: cultos aos domingos
D70: QUANTAS VEZES? | E70: VOZ PRINCIPAL | F70: VOZ SECUNDÁRIA | G70: TERCEIRA VOZ OU RESERVA | H70: TOTAL
D71: ARIANE | E71: =COUNTIF(E44:E67;"ARIANE") -> 4 | F71: =COUNTIF(F44:F67;"ARIANE") -> 4 | G71: =COUNTIF(G44:G67;"ARIANE") -> 4 | H71: =SUM(E71:G71) -> 12
D72: FABRICIO | E72: =COUNTIF(E44:E67;"FABRICIO") -> 2 | F72: =COUNTIF(F44:F67;"FABRICIO") -> 3 | G72: =COUNTIF(G44:G68;"FABRICIO") -> 3 | H72: =SUM(E72:G72) -> 8
D73: FELIPE | E73: =COUNTIF(E44:E67;"FELIPE") -> 4 | F73: =COUNTIF(F44:F68;"FELIPE") -> 4 | G73: =COUNTIF(G44:G68;"FELIPE") -> 2 | H73: =SUM(E73:G73) -> 10
D74: JAILANE | E74: =COUNTIF(E44:E67;"JAILANE") -> 3 | F74: =COUNTIF(F44:F68;"JAILANE") -> 3 | G74: =COUNTIF(G44:G68;"JAILANE") -> 4 | H74: =SUM(E74:G74) -> 10
D75: JONATAS | E75: =COUNTIF(E44:E67;"JONATAS") -> 2 | F75: =COUNTIF(F44:F67;"JONATAS") -> 2 | G75: =COUNTIF(G44:G67;"JONATAS") -> 4 | H75: =SUM(E75:G75) -> 8
D76: LEVI | E76: =COUNTIF(E44:E67;"LEVI") -> 4 | F76: =COUNTIF(F44:F67;"LEVI") -> 3 | G76: =COUNTIF(G44:G67;"LEVI") -> 3 | H76: =SUM(E76:G76) -> 10
D77: VITÓRIA | E77: =COUNTIF(E44:E67;"VITÓRIA") -> 4 | F77: =COUNTIF(F44:F67;"VITÓRIA") -> 4 | G77: =COUNTIF(G44:G67;"VITÓRIA") -> 3 | H77: =SUM(E77:G77) -> 11